{
  "schema_version": "oda.registry.v0.2.0",
  "generated_at": "2026-02-03T00:00:00Z",
  "source": "initial hand-crafted v0.1 snapshot for runtime prediction vertical slice",
  "entries": [
    {
      "id": "adapter.slurmctld",
      "entry_type": "adapter",
      "name": "SLURM slurmctld Log Adapter",
      "version": "0.1.0",
      "description": "Ingests slurmctld logs and produces oda.job.v0.2.0 job tables suitable for runtime prediction benchmarks.",
      "problem_domain": ["job-runtime-prediction"],
      "supported_sources": ["slurmctld"],
      "output_schema_version": "oda.job.v0.2.0",
      "license": "Apache-2.0",
      "tags": ["slurm", "scheduler", "ingest"],
      "reference": {
        "kind": "python",
        "python": {
          "module": "hpc_oda_commons.adapters.slurmctld.adapter",
          "object": "SlurmctldAdapter"
        }
      }
    },
    {
      "id": "model.job_runtime_baseline",
      "entry_type": "model",
      "name": "Job Runtime Baseline (Deterministic)",
      "version": "0.1.0",
      "description": "A fast, deterministic baseline for predicting job runtime using job metadata and scheduler-observable signals.",
      "problem_domain": ["job-runtime-prediction", "job-power-prediction"],
      "supported_sources": ["slurmctld"],
      "input_schema_version": "oda.job.v0.2.0",
      "output_schema_version": "oda.prediction.v0.1.0",
      "license": "Apache-2.0",
      "tags": ["baseline", "regression", "runtime"],
      "reference": {
        "kind": "python",
        "python": {
          "module": "hpc_oda_commons.models.job_runtime_baseline.model",
          "object": "JobRuntimeBaselineModel"
        }
      }
    },
    {
      "id": "model.job_runtime_xgboost",
      "entry_type": "model",
      "name": "Job Runtime XGBoost (Rolling)",
      "version": "0.1.0",
      "description": "Alternate runtime prediction model using XGBoost regression with automatic categorical one-hot/SVD preprocessing and rolling evaluation.",
      "problem_domain": ["job-runtime-prediction", "job-power-prediction"],
      "supported_sources": ["slurmctld"],
      "input_schema_version": "oda.job.v0.2.0",
      "output_schema_version": "oda.prediction.v0.1.0",
      "license": "Apache-2.0",
      "dependencies": ["xgboost>=2.0.0", "scikit-learn>=1.3.0"],
      "tags": ["alternate", "xgboost", "regression", "runtime", "rolling"],
      "reference": {
        "kind": "python",
        "python": {
          "module": "hpc_oda_commons.models.job_runtime_xgboost.model",
          "object": "JobRuntimeXGBoostModel"
        }
      }
    },
    {
      "id": "model.job_runtime_moe_xgboost",
      "entry_type": "model",
      "name": "Job Runtime MoE XGBoost (Rolling)",
      "version": "0.1.0",
      "description": "Mixture-of-Experts runtime prediction. Routes each job to a per-(user, wallclock-bin) XGBoost expert inside the shared rolling window, with bin edges derived from each training window, a window-wide fallback expert for sparse bins, and exponential time-decay sample weighting.",
      "problem_domain": ["job-runtime-prediction", "job-power-prediction"],
      "supported_sources": ["slurmctld"],
      "input_schema_version": "oda.job.v0.2.0",
      "output_schema_version": "oda.prediction.v0.1.0",
      "license": "Apache-2.0",
      "dependencies": ["xgboost>=2.0.0", "scikit-learn>=1.3.0"],
      "tags": ["alternate", "xgboost", "mixture-of-experts", "regression", "runtime", "rolling"],
      "reference": {
        "kind": "python",
        "python": {
          "module": "hpc_oda_commons.models.job_runtime_moe_xgboost.model",
          "object": "MoEXGBoostModel"
        }
      }
    },
    {
      "id": "model.job_runtime_tfidf_knn",
      "entry_type": "model",
      "name": "Job Runtime TF-IDF + kNN (Rolling)",
      "version": "0.1.0",
      "description": "Runtime prediction model using TF-IDF text vectorization of job metadata with k-nearest-neighbor regression and rolling evaluation.",
      "problem_domain": ["job-runtime-prediction", "job-power-prediction"],
      "supported_sources": ["slurmctld"],
      "input_schema_version": "oda.job.v0.2.0",
      "output_schema_version": "oda.prediction.v0.1.0",
      "license": "Apache-2.0",
      "dependencies": ["scikit-learn>=1.3.0"],
      "tags": ["alternate", "tfidf", "knn", "regression", "runtime", "rolling"],
      "reference": {
        "kind": "python",
        "python": {
          "module": "hpc_oda_commons.models.job_runtime_tfidf_knn.model",
          "object": "JobRuntimeTfidfKnnModel"
        }
      }
    },
    {
      "id": "model.job_runtime_embedding_knn",
      "entry_type": "model",
      "name": "Job Runtime Embedding + kNN (Rolling)",
      "version": "0.1.0",
      "description": "Runtime prediction model using precomputed dense embeddings of job metadata with similarity-weighted k-nearest-neighbor regression and rolling evaluation.",
      "problem_domain": ["job-runtime-prediction", "job-power-prediction"],
      "supported_sources": ["slurmctld"],
      "input_schema_version": "oda.job.v0.2.0",
      "output_schema_version": "oda.prediction.v0.1.0",
      "license": "Apache-2.0",
      "tags": ["alternate", "embedding", "knn", "regression", "runtime", "rolling"],
      "reference": {
        "kind": "python",
        "python": {
          "module": "hpc_oda_commons.models.job_runtime_embedding_knn.model",
          "object": "JobRuntimeEmbeddingKnnModel"
        }
      }
    },
    {
      "id": "model.job_runtime_signature_memorizer",
      "entry_type": "model",
      "name": "Job Runtime Signature Memorizer (Rolling)",
      "version": "0.1.0",
      "description": "Trivial-but-strong baseline: predicts the median runtime of jobs whose submit-time features are identical, drawn from the rolling training window. No fitting. Backs off by dropping features cheapest-first when nothing matches, and reports exact-match coverage alongside its metrics.",
      "problem_domain": ["job-runtime-prediction", "job-power-prediction"],
      "supported_sources": ["slurmctld"],
      "input_schema_version": "oda.job.v0.2.0",
      "output_schema_version": "oda.prediction.v0.1.0",
      "license": "Apache-2.0",
      "dependencies": [],
      "tags": ["baseline", "memorization", "regression", "runtime", "rolling"],
      "reference": {
        "kind": "python",
        "python": {
          "module": "hpc_oda_commons.models.job_runtime_signature_memorizer.model",
          "object": "JobRuntimeSignatureMemorizerModel"
        }
      }
    },
    {
      "id": "model.job_runtime_random_forest",
      "entry_type": "model",
      "name": "Job Runtime Random Forest (Rolling)",
      "version": "0.1.0",
      "description": "Alternate runtime prediction model using Random Forest regression with automatic categorical one-hot/SVD preprocessing and rolling evaluation.",
      "problem_domain": ["job-runtime-prediction", "job-power-prediction"],
      "supported_sources": ["slurmctld"],
      "input_schema_version": "oda.job.v0.2.0",
      "output_schema_version": "oda.prediction.v0.1.0",
      "license": "Apache-2.0",
      "dependencies": ["scikit-learn>=1.3.0"],
      "tags": ["alternate", "random-forest", "regression", "runtime", "rolling"],
      "reference": {
        "kind": "python",
        "python": {
          "module": "hpc_oda_commons.models.job_runtime_random_forest.model",
          "object": "JobRuntimeRandomForestModel"
        }
      }
    },
    {
      "id": "model.job_runtime_mlp",
      "entry_type": "model",
      "name": "Job Runtime Feed-Forward MLP (Rolling)",
      "version": "0.1.0",
      "description": "Alternate runtime prediction model using a feed-forward neural network (sklearn MLPRegressor) with automatic categorical one-hot/SVD preprocessing and rolling evaluation.",
      "problem_domain": ["job-runtime-prediction", "job-power-prediction"],
      "supported_sources": ["slurmctld"],
      "input_schema_version": "oda.job.v0.2.0",
      "output_schema_version": "oda.prediction.v0.1.0",
      "license": "Apache-2.0",
      "dependencies": ["scikit-learn>=1.3.0"],
      "tags": ["alternate", "mlp", "neural-network", "regression", "runtime", "rolling"],
      "reference": {
        "kind": "python",
        "python": {
          "module": "hpc_oda_commons.models.job_runtime_mlp.model",
          "object": "JobRuntimeMlpModel"
        }
      }
    },
    {
      "id": "model.job_power_uopc",
      "entry_type": "model",
      "name": "Job Power UoPC (User kNN, Fixed)",
      "version": "0.1.0",
      "description": "User-based online power prediction (UoPC): per-user kNN regression on label-encoded job features on a fixed split; the paper protocol (embedding features, kNN-classifier voting, per-node targets) on a date cutoff; or the same paper model scored on the shared rolling windows.",
      "problem_domain": ["job-power-prediction"],
      "supported_sources": ["slurmctld"],
      "input_schema_version": "oda.job.v0.2.0",
      "output_schema_version": "oda.prediction.v0.1.0",
      "license": "Apache-2.0",
      "dependencies": ["scikit-learn>=1.3.0"],
      "tags": ["uopc", "knn", "regression", "power", "fixed", "user-based"],
      "reference": {
        "kind": "python",
        "python": {
          "module": "hpc_oda_commons.models.job_power_uopc.model",
          "object": "JobPowerUopcModel"
        }
      }
    },
    {
      "id": "recipe.job_runtime.baseline_tiny",
      "entry_type": "recipe",
      "name": "Baseline Tiny (Job Runtime Prediction)",
      "version": "0.1.0",
      "description": "Tiny synthetic benchmark recipe for runtime prediction baseline; used for CI smoke and offline demo.",
      "problem_domain": ["job-runtime-prediction"],
      "supported_sources": ["slurmctld"],
      "input_schema_version": "oda.job.v0.2.0",
      "license": "Apache-2.0",
      "tags": ["tiny", "ci", "offline"],
      "reference": {
        "kind": "path",